,Coin name,link,description_list
0,OpenANX,https://coinranking.com/coin/GPtUqoc-nl-aA+openanx-oax,"OpenANX is a project that strives to provide support for decentralized finance and digital assets, offering alternatives to traditional financial ecosystems."
1,TOMI,https://coinranking.com/coin/1AOhZH6Wr+tomi-tomi,"TL;DR: TOMI is a Web3 platform empowering individuals with technology to promote and protect their digital rights, prioritizing privacy, anti-censorship, and freedom of speech."
2,DREP,https://coinranking.com/coin/Y6tLhd95EZQE+drep-drep,DREP is building blockchain-based connectors & toolkits to create an open data ecosystem & enable one-click integration of DApps.
3,Mirror Finance,https://coinranking.com/coin/R1Buw5eu2+mirrorfinance-mir,"MIR token enables 24/7 equities trading by minting synthetic versions of real world assets, and allows users to propose and vote on changes to the protocol."
4,REI Network,https://coinranking.com/coin/4vjXnsJWN+reinetwork-rei,"REI Network was created to adjust the improvement pattern of the blockchain, and to accomplish a lightweight, Ethereum viable, better execution, and no expense blockchain system."
5,Wrapped Ether,https://coinranking.com/coin/Mtfb0obXVh59u+wrappedether-weth,WETH (Wrapped Ethereum) is a token that represents an ERC-20 version of ETH on the Ethereum blockchain. Every WETH is 1:1 backed by real ETH.
6,BitForex Token,https://coinranking.com/coin/2nh5ugplNocUp+bitforextoken-bf,"BitForex Token (BF) is the native token of the BitForex ecosystem, offering trading bonuses, access to events, and premium airdrops."
7,Hifi Finance,https://coinranking.com/coin/eY5kANx7k+hififinance-hifi,The project is a collection of exciting new projects and partnerships that build upon and integrate into Hifi's lending protocol.
8,Baby Doge Coin,https://coinranking.com/coin/JY1_q2c0g+babydogecoin-babydoge,"Baby Doge Coin is a new crypto with improved transaction speeds, adorableness and hyper-deflationary static reflection that rewards holders."
9,REVV,https://coinranking.com/coin/OMVdNqHmh+revv-revv,"REVV is an ERC-20 utility token designed to be the currency of purchase, utility, and action in supported play-to-earn motorsport blockchain games."
10,BlockBank,https://coinranking.com/coin/OvXm3l5M7+blockbank-bbank,BlockBank plans to combine DeFi and CeFi with AI to provide customers with improved financial services.
11,Origin protocol,https://coinranking.com/coin/IdrU0Gp2cK+originprotocol-ogn,"\nOrigin is a fully distributed team providing lower fees, better incentives, increased access, and more resilience to decentralized commerce and finance."
12,Safemoon V2,https://coinranking.com/coin/ychMzX07D+safemoonv2-sfm,Safemoon V2 is a new DeFi token that offers holders rewards for staking and liquidity mining.
13,Lovely Inu,https://coinranking.com/coin/2_kBJoo_-+lovelyinu-lovely,LOVELY Token vision to make the record by growing token price. LOVELY is a utility token and a decentralized meme token
14,Rainmaker Games,https://coinranking.com/coin/L7OX-iic0+rainmakergames-rain,"Rainmaker Games is a platform that allows gamers to switch between games, train, learn, manage profits, visit, and get Guild Verified."
15,Flamingo,https://coinranking.com/coin/lHw_McGnP+flamingo-flm,Flamingo is a decentralized finance platform in view of the Neo blockchain and the Poly Network interoperability protocol. It joins a few DeFi applications into a solitary environment.
16,Seedify.fund,https://coinranking.com/coin/HJnwPbzqP7+seedifyfund-sfund,"Seedify.fund is a blockchain gaming hatchery and platform that provides funding, community, and support to innovators."
17,Tokenlon,https://coinranking.com/coin/pvpvPqRqL+tokenlon-lon,"LON is a utility token issued by the Tokenlon DEX, used to adjust all ecosystem partners and boost cooperation and extension of the environment."
18,Dejitaru Tsuka,https://coinranking.com/coin/zE7dgBOcF+dejitarutsuka-tsuka,"Tsuka is a decentralized community that is based on contemplation, reflection, and research."
19,Perpetual Protocol,https://coinranking.com/coin/0GZ2qBGZF+perpetualprotocol-perp,"Perpetual Protocol democratizes advanced trading tools, allowing anyone to trade with up to 10x leverage, short sell, provide liquidity, and stake tokens."
20,Ampleforth Governance Token,https://coinranking.com/coin/7zzwdCwfm+ampleforthgovernancetoken-forth,"Forth is Ampleforth's governance token, allowing holders to vote on proposed changes to the protocol and complete the Ample ecosystem."
21,Serum,https://coinranking.com/coin/gDTpVbAhv+serum-srm,"Serum (SRM) is a decentralized derivatives exchange project that enables trustless, permissionless cross-chain trading on Solana and Ethereum."
22,Uquid Coin,https://coinranking.com/coin/fMNxR6LqdnRZp+uquidcoin-uqc,"Uquid Coin is a decentralized virtual currency based on Ethereum technology, aiming to bridge DeFi and e-commerce with automated shopping making and smart contracts."
23,FTX Token,https://coinranking.com/coin/NfeOYfNcl+ftxtoken-ftt,"FTX Token (FTT) is a native token of FTX Exchange, allowing users to pay fewer fees, receive socialized gains, buy/burn fees, and use as collateral for futures trading."
24,pSTAKE Finance,https://coinranking.com/coin/5LUuh9pOu+pstakefinance-pstake,pSTAKE enables stakers to earn rewards and yield on their PoS tokens while maintaining liquidity.
25,Ellipsis,https://coinranking.com/coin/AjWfgDP8+ellipsis-epx,Ellipsis is a cryptocurrency and works on the BNB Smart Chain platform. Ellipsis has an ongoing stock of 0.
26,Ooki Protocol,https://coinranking.com/coin/j_zgm6Fzd+ookiprotocol-ooki,"Ooki Protocol is a decentralized finance protocol that enables lenders, borrowers, and brokers to interact on different blockchains."
27,Juventus Fan Token,https://coinranking.com/coin/UarBPbycz+juventusfantoken-juv,"They work with some of the most prestigious sports teams in the world, and theyact like one. They think, train and play to win, enjoying every second of the game."
28,Crust Network,https://coinranking.com/coin/DscaCqJl7+crustnetwork-cru,"Crust Network provides decentralized storage and cloud solutions for Web 3.0 and Web 2.0, based on Polkadot's Substrate and IPFS, with blockchain-enhanced security, performance, and accountability."
29,Troy,https://coinranking.com/coin/JdGL83Vu+troy-troy,"Troy is a smart hybrid asset management platform driven by inclusivity, profitability, security, and service."
30,Akropolis,https://coinranking.com/coin/shjxZ0hQM+akropolis-akro,"Akropolis (AKRO) provides tools to save, grow and provision for the future without relying on intermediaries."
31,Gods Unchained,https://coinranking.com/coin/DbmYlAsxj+godsunchained-gods,GODS token is the currency utilized in the blockchain-based web-based trading card game.
32,Choise.com,https://coinranking.com/coin/vKolHD084+choisecom-cho,Choise.com is a MetaFi platform that consolidates every one of the advantages of CeFi Crypterium administrations and the Charism DeFi ecosystem.
33,Kaspa,https://coinranking.com/coin/V8GxkwWow+kaspa-kas,"Kaspa is a proof-of-work cryptocurrency that implements the GHOSTDAG protocol, allowing parallel blocks to coexist and be ordered in consensus."
34,FIO Protocol,https://coinranking.com/coin/sdxCUpYxe+fioprotocol-fio,FIO Protocol is a blockchain protocol that plans to empower a better approach to sending/getting coins and tokens.
35,Findora,https://coinranking.com/coin/SYtg0KAoQ+findora-fra,"Findora is a public blockchain with programmable protection, allowing users conditional security with specific suitability."
36,UMA,https://coinranking.com/coin/6Cnl5FOCZ+uma-uma,"UMA is a blockchain protocol for trading and executing financial contracts, enabling the creation of synthetic assets tracking any price."
37,Prometeus,https://coinranking.com/coin/-HYrdBaCAa3mC+prometeus-prom,"Prometeus Labs unites professionals from various industries to create a decentralized, censorship-free communication platform."
38,Telos,https://coinranking.com/coin/5TDMcKcKHjmg+telos-tlos,"Telos is a smart contract blockchain running on EOSIO software, offering dApp developers 0.5s block times, 1000+ TPS, free transactions ' governance features."
39,VNDC,https://coinranking.com/coin/hWZNRGm8+vndc-vndc,"VNDC is a stablecoin pegged to the Vietnam Dong, based on Ethereum and Binance Chain."
40,Tokocrypto,https://coinranking.com/coin/fjw3DeMxg+tokocrypto-tko,"Tokocrypto is a Southeast Asian crypto exchange providing an easy, secure platform for users to make transactions and a community hub for crypto enthusiasts."
41,aelf,https://coinranking.com/coin/MvVrm09NjVxNR+aelf-elf,"Ælf (Aelf, ELF) is a blockchain-based company with a decentralized cloud operating system, segregated nodes, and voting rights for token holders."
42,Tornado Cash,https://coinranking.com/coin/1rqrL4Dlo+tornadocash-torn,"Tornado Cash is a decentralized, non-custodial protocol for private crypto transactions, deployed by the community."
43,Siacoin,https://coinranking.com/coin/y9op7QPvbLERt+siacoin-sc,"Siacoin is a blockchain-based storage platform with its own native currency, enabling open and decentralized storage trading."
44,WHALE,https://coinranking.com/coin/qLybsCm3y+whale-whale,WHALE is a social currency that is backed by tangible and rare NFT assets while embodying scarcity through definitive limited issuance.
45,Adventure Gold,https://coinranking.com/coin/SoZYFQ6gj+adventuregold-agld,"Loot is randomized traveler gear produced and put away on-chain. Details, pictures, and other uses are deliberately excluded for others to decipher."
46,Ambire AdEx,https://coinranking.com/coin/kQtHWeGYp+ambireadex-adx,"Ambire AdEx, recently known as AdEx Network, developing a new solution for digital advertising and a DeFi-focused crypto wallet."
47,BeNFT AI,https://coinranking.com/coin/S3dGnLfbJ+benftai-beai,"BeNFT combines blockchain and AI avatars for an immersive e-learning experience, aiming to shape the future of education."
48,Nano,https://coinranking.com/coin/JIzIQBmw7+nano-xno,"Nano is a cryptocurrency with no exchange fees, based on a block-lattice data structure for limitless versatility."
49,Ethernity Chain,https://coinranking.com/coin/Jjp7zDT2s+ethernitychain-ern,Ethernity Chain is a blockchain-based platform that enables users to take advantage of the growing popularity of NFTs.
